{
  "schema_version": "0.1",
  "skill": "hub-ml-feature-engineering",
  "mode": "audit",
  "resources": [],
  "templates": [],
  "metadata": {
    "b1": {
      "state": "CANDIDATE_NOT_PROMOTED",
      "stage_level": "L4_SYNTHETIC_EFFECT_PROBE",
      "profile": "FREE_SYNTHETIC_PIT_FEATURE_MATERIALIZATION_V1",
      "upstream_profile": "COMPOSED_PIT_FEATURE_VIEW_V1",
      "authority": "SYNTHETIC_FEATURE_MATERIALIZATION_PROBE",
      "target_pattern": "workspace.default.skills_delivery_<32 lowercase hex>",
      "schema": "decision_id STRING, entity_id STRING, decision_at STRING UTC, feature_value BIGINT nullable, available_at STRING UTC nullable",
      "upstream_receipt_postflight_required": true,
      "delta_history_required": true,
      "cleanup": "DROP_OWNED",
      "fit": false,
      "business_materialization": false,
      "promotion_authorized": false
    }
  }
}
