{
  "schema_version": "0.1",
  "skill": "hub-ml-cross-eda-ml",
  "mode": "audit",
  "resources": [
    {
      "id": "point_in_time_join",
      "policy": "required",
      "evidence": "call",
      "module": "hub_snippets.spark.pit_join",
      "symbol": "pit_join"
    }
  ],
  "templates": [],
  "metadata": {
    "b1": {
      "state": "CANDIDATE_NOT_PROMOTED",
      "stage_level": "L4_LOCAL_PROFILE",
      "profile": "LOCAL_SYNTHETIC_PIT_V1",
      "runner_entrypoint": "scripts/run_pit.py::run",
      "verifier_entrypoint": "scripts/verify_pit.py::verify_finalized",
      "limitations": ["constant lag", "UTC", "LE", "no bitemporal history", "no business readiness"]
    },
    "postflight": {
      "schema_version": "1.0",
      "policy": "fail_closed",
      "handoff": {
        "required": ["scope", "source_content_sha256", "decision_rows", "temporal_contract", "limitations"],
        "allow_empty": []
      }
    }
  }
}
