{
  "schema_version": "0.1",
  "skill": "hub-ml-pipeline-builder",
  "mode": "audit",
  "metadata": {
    "delivery": {
      "profile": "LOCAL_SYNTHETIC_SPEC_V1",
      "stage_level": "L2",
      "state": "CANDIDATE_NOT_PROMOTED",
      "unimplemented_surfaces": [
        "deploy",
        "write",
        "run",
        "Databricks",
        "Genie"
      ],
      "entrypoint": "scripts/preflight.py::preflight"
    }
  },
  "resources": [],
  "templates": [
    {
      "id": "pipeline_spec",
      "path": "templates/pipeline_spec.md",
      "policy": "required",
      "evidence": "loaded"
    }
  ]
}
