{
  "schema_version": "0.1",
  "skill": "hub-ml-monitoramento-modelo",
  "mode": "audit",
  "metadata": {"b1": {"state": "CANDIDATE_NOT_PROMOTED", "scope": "stage_specific", "stage_level": "L3", "profile": "DRIFT_NUMERIC_LOCAL_V1", "input_schema": "SER11-REQUEST-1", "input_schema_file": "input.schema.json", "receipt_version": "1.0", "request_entrypoint": "scripts/preflight.py::preflight", "runner_entrypoint": "scripts/run.py::run", "verifier_entrypoint": "scripts/verify.py::verify", "unimplemented_surfaces": ["labels", "performance", "retraining", "alerts", "Free", "Genie", "remote_action"]}},
  "resources": [
    {"id": "drift_numeric", "module": "hub_snippets.ml.drift_detection", "symbol": "calculate_psi", "policy": "required", "evidence": "call"}
  ],
  "templates": []
}
