{
  "schema_version": "0.1",
  "skill": "hub-ml-eda-profissional",
  "mode": "audit",
  "metadata": {
    "initiative": "skill_enforcement_framework",
    "sprint": "SE01",
    "pilot": true,
    "baseline": "SE00",
    "purpose": "Declarar recursos verificáveis e a política fail-closed de homologação da execução.",
    "postflight": {
      "schema_version": "1.0",
      "policy": "fail_closed",
      "handoff": {
        "required": [
          "sources_snapshot",
          "unit_keys_target",
          "quality_risks",
          "feature_candidates_leakage",
          "filters_sample",
          "open_questions"
        ],
        "allow_empty": [
          "open_questions"
        ]
      }
    }
  },
  "resources": [
    {
      "id": "quick_profile",
      "module": "hub_scripts.quick_profile",
      "symbol": "quick_profile",
      "policy": "required",
      "evidence": "call"
    },
    {
      "id": "data_quality_check",
      "module": "hub_scripts.data_quality_check",
      "symbol": "data_quality_check",
      "policy": "conditional",
      "evidence": "call",
      "condition": {
        "kind": "pk_columns_available"
      }
    },
    {
      "id": "null_summary",
      "module": "hub_snippets.spark.null_summary",
      "symbol": "null_summary",
      "policy": "required",
      "evidence": "call"
    },
    {
      "id": "smart_sample",
      "module": "hub_snippets.spark.smart_sample",
      "symbol": "smart_sample",
      "policy": "conditional",
      "evidence": "call",
      "condition": {
        "kind": "local_sample_required"
      }
    },
    {
      "id": "safe_display",
      "module": "hub_snippets.spark.safe_display",
      "symbol": "safe_display",
      "policy": "conditional",
      "evidence": "call",
      "condition": {
        "kind": "tabular_preview_required"
      }
    },
    {
      "id": "correlation_matrix",
      "module": "hub_snippets.display.correlation_matrix",
      "symbol": "plot_correlation",
      "policy": "conditional",
      "evidence": "call",
      "condition": {
        "kind": "numeric_columns_at_least",
        "value": 2
      }
    },
    {
      "id": "distribution_grid",
      "module": "hub_snippets.display.distribution_grid",
      "symbol": "plot_distributions",
      "policy": "conditional",
      "evidence": "call",
      "condition": {
        "kind": "numeric_distributions_requested"
      }
    },
    {
      "id": "theme_plotly",
      "module": "hub_snippets.visual.theme_plotly",
      "symbol": "aplicar_tema_resolvido",
      "policy": "conditional",
      "evidence": "call",
      "condition": {
        "kind": "resolved_theme_selected"
      }
    },
    {
      "id": "index_generator",
      "module": "hub_snippets.visual.index_generator",
      "symbol": "gerar_indice_eda",
      "policy": "optional",
      "evidence": "call"
    },
    {
      "id": "format_br",
      "module": "hub_snippets.constants.format_br",
      "symbol": "fmt_int",
      "policy": "optional",
      "evidence": "call"
    }
  ],
  "templates": [
    {
      "id": "roteiro_eda",
      "path": "templates/roteiro_eda.md",
      "policy": "required",
      "evidence": "loaded"
    },
    {
      "id": "matriz_graficos_eda",
      "path": "templates/matriz_graficos_eda.md",
      "policy": "conditional",
      "evidence": "loaded",
      "condition": {
        "kind": "visual_diagnostics_requested"
      }
    },
    {
      "id": "relatorio_executivo_eda",
      "path": "templates/relatorio_executivo_eda.md",
      "policy": "required",
      "evidence": "loaded"
    },
    {
      "id": "estilo_visual_eda",
      "path": "templates/estilo_visual_eda.md",
      "policy": "conditional",
      "evidence": "loaded",
      "condition": {
        "kind": "visual_diagnostics_requested"
      }
    }
  ]
}
