{
  "schema_version": "0.1",
  "skill": "hub-ml-micromodelos",
  "mode": "audit",
  "metadata": {
    "se07": {
      "enforcement_level": "L1",
      "scope": "stage_specific",
      "runtime_gate": false,
      "static_invariants": [
        "micromodelo_yaml_is_canonical_specification",
        "metadata_only_does_not_read_rows_or_execute_sql",
        "observed_hypothesis_approved_measured_are_distinct",
        "absence_of_evidence_is_indeterminate",
        "heuristic_score_is_not_probability",
        "publication_requires_external_governance"
      ]
    }
  },
  "resources": [],
  "templates": []
}
