{
  "schema_version": "0.1",
  "skill": "hub-ml-pipeline-builder",
  "mode": "audit",
  "resources": [],
  "templates": [],
  "metadata": {
    "delivery": {
      "profile": "FREE_SYNTHETIC_DELTA_MERGE_V1",
      "stage_level": "L4_EFFECT_PROBE",
      "state": "CANDIDATE_NOT_PROMOTED",
      "authority": {
        "authorized": true,
        "effect": "SYNTHETIC_DELTA_PROBE",
        "namespace": "workspace.default",
        "target_pattern": "skills_delivery_<32 lowercase hex>",
        "request_digest": "sha256",
        "run_id": "caller-bound",
        "nonce": "32 lowercase hex",
        "cleanup": "DROP_OWNED",
        "principal": "runtime-verified"
      },
      "effect_record": "SER14-DELTA-EFFECT-1",
      "receipt": "compute-only upstream",
      "business_deployment": false
    }
  }
}
