{
  "metadata": {
    "b1": {
      "input_schema": "SER05-CONTEXT-1",
      "input_schema_file": "input.schema.json",
      "join_executed": false,
      "profile": "CONTEXT_ONLY_PILOT_V1",
      "scope": "stage_specific",
      "stage_level": "L2",
      "state": "CANDIDATE_NOT_PROMOTED",
      "temporal_contract_owner": "hub_scripts.skill_execution.domain_context",
      "temporal_contract_version": "SER-TEMPORAL-CONTEXT-1",
      "unimplemented_surfaces": [
        "Spark_join",
        "join_diagnostics",
        "Postflight_L4",
        "Free",
        "Genie"
      ]
    }
  },
  "mode": "audit",
  "resources": [
    {
      "evidence": "resolved",
      "id": "temporal_context",
      "module": "hub_scripts.skill_execution.domain_context",
      "policy": "required",
      "symbol": "validate_temporal_context"
    }
  ],
  "schema_version": "0.1",
  "skill": "hub-ml-cross-eda-ml",
  "templates": []
}
