{
  "metadata": {
    "b1": {
      "input_schema": "SER03-REQUEST-1",
      "input_schema_file": "input.schema.json",
      "profile": "MONTHLY_BINARY_PILOT_V1",
      "receipt_version": "1.0",
      "request_entrypoint": "scripts/preflight.py::preflight",
      "runner_entrypoint": "scripts/run.py::run",
      "scope": "stage_specific",
      "stage_level": "L3",
      "state": "CANDIDATE_NOT_PROMOTED",
      "unimplemented_surfaces": [
        "quarterly",
        "compare_safras",
        "monetary_loss",
        "plots",
        "Free",
        "Genie"
      ],
      "verifier_entrypoint": "scripts/verify.py::verify"
    }
  },
  "mode": "audit",
  "resources": [
    {
      "evidence": "call",
      "id": "vintage_core",
      "module": "hub_snippets.ml.vintage_analysis",
      "policy": "required",
      "symbol": "build_vintage_table"
    }
  ],
  "schema_version": "0.1",
  "skill": "hub-ml-analise-safra",
  "templates": []
}
