{
  "schema_version": "0.1",
  "skill": "hub-ml-auditoria-skills",
  "mode": "audit",
  "metadata": {
    "se07": {
      "enforcement_level": "L3",
      "target_level": "L3",
      "scope": "stage_specific",
      "runtime_gate": true,
      "static_invariants": [
        "consume_existing_mechanical_verdict_before_editorial_judgment",
        "preserve_cited_located_read_imported_called_completed_ladder",
        "persisted_state_is_not_independent_reverification",
        "conditional_applicability_requires_observable_evidence",
        "pre_execution_absence_is_not_execution_failure",
        "do_not_create_parallel_canonical_compliance_verdict"
      ],
      "preflight_contract": {
        "output_mode_required_fields": [
          "producer_skill",
          "original_request_present",
          "artifact_present"
        ],
        "implementation_mode_required_fields": [
          "target_skills"
        ],
        "non_blocking_gap": [
          "producer_sef_policy_not_registered"
        ]
      },
      "runner_contract": {
        "entrypoint": "scripts/run.py::run",
        "receipt_version": "SE07-AUDIT-RECEIPT-1",
        "protected_step": "audit_evidence_classifier",
        "direct_verifier_adapter": {
          "hub-ml-eda-profissional": "scripts/postflight.py::verify_finalized"
        },
        "canonical_verifier_return": {
          "required_fields": [
            "status",
            "valid",
            "completion_authorized",
            "completion_claim_consistent",
            "issues"
          ],
          "issues": "lista ou tupla de strings; PASS_REVERIFIED exige coleção vazia (lista ou tupla), normalizada para lista na saída",
          "failure_boundary": "falha de importação não é reverificação; falha de chamada ou retorno malformado não passa"
        },
        "guarantees": [
          "no_state_promotion_by_inference",
          "producer_compliance_remains_not_reverified_without_canonical_verifier",
          "audit_receipt_certifies_audit_runner_not_producer_completion",
          "no_persistent_writes"
        ]
      }
    }
  },
  "resources": [],
  "templates": [
    {
      "id": "rubrica_universal",
      "path": "templates/rubrica_universal.md",
      "policy": "optional",
      "evidence": "loaded"
    },
    {
      "id": "relatorio_auditoria",
      "path": "templates/relatorio_auditoria.md",
      "policy": "optional",
      "evidence": "loaded"
    }
  ]
}
