{
  "schema_version": "0.1",
  "skill": "hub-ml-baseline-ml",
  "mode": "audit",
  "metadata": {"b1": {"state": "CANDIDATE_NOT_PROMOTED", "scope": "stage_specific", "stage_level": "L3", "profile": "BINARY_TEMPORAL_LOCAL_V1", "input_schema": "SER09-REQUEST-1", "input_schema_file": "input.schema.json", "receipt_version": "1.0", "request_entrypoint": "scripts/preflight.py::preflight", "runner_entrypoint": "scripts/run.py::run", "verifier_entrypoint": "scripts/verify.py::verify", "unimplemented_surfaces": ["MLflow", "Free", "Genie", "registry_promotion", "business_model_selection"]}},
  "resources": [
    {"id": "temporal_split", "module": "hub_snippets.ml.split_temporal", "symbol": "temporal_split", "policy": "required", "evidence": "call"},
    {"id": "metrics_report", "module": "hub_snippets.ml.metrics_report", "symbol": "calculate_binary_metrics", "policy": "required", "evidence": "call"}
  ],
  "templates": []
}
