{
  "schema_version": "0.1",
  "skill": "hub-ml-concierge",
  "mode": "audit",
  "metadata": {
    "se07": {
      "enforcement_level": "L1",
      "scope": "whole_skill",
      "runtime_gate": false,
      "static_invariants": [
        "discovery_and_routing_only",
        "do_not_execute_final_specialist_analysis",
        "do_not_invent_target_key_threshold_budget_policy_or_authorization",
        "handoff_does_not_expand_authority"
      ]
    }
  },
  "resources": [],
  "templates": [
    {
      "id": "recomendacao",
      "path": "templates/recomendacao.md",
      "policy": "optional",
      "evidence": "loaded"
    },
    {
      "id": "handoff",
      "path": "templates/handoff.md",
      "policy": "optional",
      "evidence": "loaded"
    },
    {
      "id": "registro_busca",
      "path": "templates/registro_busca.md",
      "policy": "optional",
      "evidence": "loaded"
    }
  ]
}
